Do we love our guns more than our children?,"(CNN) When I was 12, in the sixth grade in El Cerrito, California, one of my classmates brought a gun to school. She was a bright fellow student -- flamboyant, funny, sometimes moody -- occasionally in trouble, fun to play kickball with. I still remember her throaty laugh. I also remember the awful day while we stood on the play yard, as she pulled a gun out of her backpack and pointed it at a group of sixth-grade girls, threatening to shoot.

I remember how someone saw and called a teacher; how someone got her to the ground and disarmed her. I remember how two men lifted her small body and carried it out of the school, and out of our lives. We were, that day, all spared, and we went on living. That was in 1988, during the same school year the nation was rocked by the Stockton massacre -- the first large shooting on a public school campus, a shooting that took place a few hours from my town. We lived in the vibration of that fear. And as kids, we asked our parents why this would happen, and how to make it better.

Nearly 30 years later, my son goes to the same elementary school I attended. He's in first grade and each day he and other neighborhood kids swing their lunchboxes at the crosswalk before getting in line for class on the same yard I played on at his age.

I am teaching my son how to cross the street safely, how to make playdates, how to read. He has just lost his two front teeth, is starting to read chapter books, and is obsessed with Greek myths. He's learned drills for earthquakes and fires. He's also learning the drill for what happens when an ""unsafe person"" comes to school. He's 6 years old, and he already has had to absorb that each day there's a chance that someone could come and shoot him in his classroom.

I know it too, which is why when my phone flashed with an alert for a shooting in Northern California schools after the Rancho Tehama shooting, my blood ran cold and I had to sit down and let the wave of grief pass over me before I could even read further. I only partly exhaled.

Rancho Tehama is three hours away, but the truth is, it's still too close. Sandy Hook is too close. Sutherland Springs is too close. Las Vegas is too close. Charleston is too close. Any day, any moment, it could be any of us, or any of our children, any of their bright lives. And the question I asked when I was 12 still hangs in the balance: What are we doing to make it better?

Not everywhere is like this. Last year, my family and I left the US to spend time in Northern Ireland, a place not historically known for its peace. As we enrolled my son for school in downtown Belfast, he asked the school principal to describe the school drills. She looked a bit puzzled. She told him about the fire drill. And he asked her ""do you have unsafe person drills""?

As he asked us, all of our faces crumpled. ""No, love,"" she said. ""No, we do not."" And: they don't. Like other developed countries, like most other countries, period, they don't now expect that people might come into their schools and shoot their children.

Living in Europe I could sense how other countries are baffled by the fact that we put up with this. My son also wants to know. I also want to know why we insist on passing on such trauma to our children. I have tried to understand why a city that was caught in shattering decades-long terrorist struggle is now safer for its children than small towns in California or Texas. I have tried hard to imagine what is in the heart of someone who offers ""thoughts and prayers"" after yet another massacre, but says ""it's not the time"" to even learn how to enact sensible regulation of guns.

In the US, we alone bear this burden and this fear: Of the 23 richest nations in the world, according to a 2011 study , we now have 87% of the gun violence, and according to the Journal of TRAUMA Injury, Infection, and Critical Care, 87% of children killed by guns are killed here . Think of it: across the world, 87% of the children killed by guns are killed here, in our country. Breathe into that fact. Imagine all those bright bodies, all the bodies you can, the noses, the eyelashes, the hopes.

When my son looks at me and tries to ask why this is the case, I cannot think what to tell him. I can only believe that for now at least, we are a country that continues to keep loving our guns more than we love our children; that we put our guns above the health of our children, and above the health of each other.

We live in a country where we do not even allow the CDC to study gun violence as the epidemic it is; where we cannot pass the simplest ban on automatic rifles; or where the Air Force fails to keep guns out of the hands of someone it itself noticed was abusive; where men with a history of abusive behavior again and again go on public rampages.

I am tired of living in a cycle where we choose our own trauma and violence over solutions. I am furious at politicians who accept money and then cower before the gun lobby. I am furious that a few loudmouthed interest groups force the rest of us to raise generations of children in fear. I am furious that we do not have adequate mental health services for people in need. I am furious that we are not demanding more of our politicians and more of ourselves. I am tired of treating white male domestic-abusers who massacre people as some kind of unsolvable problem. I can only believe that for now at least, we are a country who keeps loving our guns more than we love our children.

Personally, I've begun to feel that my Second Amendment rights are being violated. I was promised the right to a well-regulated militia, and instead I see a nation that falls victim, week after week, body after body, to a series of unstable people with elaborately hoarded arsenals. I am absolutely sure our founders would be appalled. I am absolutely sure that our founders would not wish that we run out and buy even more guns because of it.

Follow CNN Opinion Join us on Twitter and Facebook

This is a country of hunters and sportsmen, my family included. I cannot foresee an America without guns. I can imagine an America, though, where we act as if our children's lives are worth more than our guns, where we decide that we can no longer tolerate living within a raging epidemic of violence. I can imagine an America where we worry more that a domestic abuser will get a gun and kill someone than we worry about the brief annoyance of a background check. I can imagine an America where we don't imagine we need guns in churches, schools, or Starbucks, national parks.

Thirty years ago, I walked off a field alive. Far too many American children have not been so lucky. It should not be luck. We should be confident in our daily peace. There should be no unsafe person drills here.",REAL
Murder charge dropped in Amazon Echo case,"(CNN) A judge dismissed a murder charge against an Arkansas man in a case that drew national attention when prosecutors sought evidence they believed was stored in an Amazon Echo speaker.

James Bates was charged with first-degree murder in the 2015 death of Victor Collins after a night of drinking and watching football. Collins was found floating face-down in Bates' hot tub, police said.

County Prosecuting Attorney Nathan Smith filed a motion on Tuesday to dismiss the case against Bates, saying the current evidence supports more than one ""reasonable explanation"" for Collin's death, according to court documents obtained by CNN.

""I can't stand in front of a jury and ask them to convict someone beyond a reasonable doubt if I myself have a reasonable doubt,"" Smith told CNN affiliate KNWA

For that reason, the motion states, prosecutor was obligated to request the dismissal of Bates' case at this time.

""I'm 100% innocent,"" Bates told KNWA after the charges were dropped Wednesday. ""I did nothing wrong, I'm not going to hide. I'm going to stay right here.""

The state has one year to refile charges against Bates but his attorney, Kathleen Zellner, said it's unlikely because prosecutors would need ""new evidence.""

""Obviously we are very happy that the prosecution dismissed the case but also have empathy for the victim and the victim's family. This is not a day of rubbing it on anyone's face,"" she added.

For Collins' widow, Kristine, Wednesday's decision was devastating.

""Prosecutors have let us all down today,"" Kristine Collins said.

""I had to go home last night, sit down with my children and explain to them that the person that killed their father, who prevents them from Father's Days and Christmases and a regular life, is going to continue to enjoy those things with his family without any recourse whatsoever for what he has done to mine,"" she added.

The case

The Amazon Echo entered the November 2015 murder case because someone present on the night of Collins' death allegedly recalled hearing music streaming through the device that evening.

Amazon initially rebuffed the prosecution's request but later provided the data after Bates said he would voluntarily hand over the recordings.

According to Amazon, Echo works by constantly listening for the ""wake word"" -- ""Alexa"" or ""Amazon,"" by default -- and then records your voice and transfers it to a processor for analysis so that it can fulfill requests or answer questions. The recordings are streamed and stored remotely, and can be reviewed or deleted over time, Amazon said.

On the night of the incident, Bates had invited two friends -- one of them former Georgia police officer Collins, 47 -- over to his Bentonville home. They watched college football, drank beer and vodka, according to the search warrant affidavit filed in Benton County Circuit Court. The men decided to get into Bates' hot tub and Bates said he went to bed around 1 a.m. When he woke up the next morning, Collins was floating face-down in the hot tub, an affidavit said.

Bates' attorney at the time, Kimberly Weber, said Collins was Bates' friend, and his death was a tragic accident, possibly stemming from his drinking. Collins' blood-alcohol content at the time of death was .32, four times the legal limit to drive in Arkansas, she said.",REAL
US to deport undocumented immigrant acquitted in Kate Steinle death,"San Francisco (CNN) A Mexican man will be deported after he was found not guilty in the killing of Kate Steinle, whose death while out walking on a San Francisco pier reignited a national debate over immigration policy.

Jurors acquitted Jose Ines Garcia Zarate, 45, of murder and involuntary manslaughter, as well as assault with a deadly weapon. They convicted him of being a felon in possession of a firearm.

The undocumented immigrant faces up to three years in prison, but has already spent more than two years in jail awaiting trial and may get credit for time served. He has not been sentenced.

'I'm not surprised'

Kate Steinle's brother said the theft of the gun set off a series of system failures that culminated with the ruling.

""I'm not surprised. The system failed Kate from the start of this chain of events. Why would the verdict be any different?"" Brad Steinle said. ""From the drug charge. To being released. To not being detained by ICE. The BLM agent leaving a loaded weapon in an unlocked car. It is failure after failure.""

Steinle said the verdict does not affect them in any way.

""Kate is gone. The strength we have is drawn from Kate. Her memory is with us,"" he said.

Debate over sanctuary city

The case sparked a fierce debate over sanctuary cities, and forced San Francisco officials to defend its policy. President Donald Trump invoked the case in decrying sanctuary cities and promoting the construction of the wall along the Mexican border.

A sanctuary city has policies designed to limit its cooperation with federal officials on immigration enforcement.

""San Francisco's policy of refusing to honor ICE detainers is a blatant threat to public safety and undermines the rule of law,"" Tom Homan, deputy director of ICE, said in a statement.

Homan said ICE plans to take custody of Garcia Zarate and ""ultimately remove him from the country."" It's unclear whether it'll be before or after he serves his sentence.

Trump called the verdict ""disgraceful,"" while Attorney General Jeff Sessions said San Francisco's status as a sanctuary city was largely to blame for what happened.

Kate Steinle, 32, was killed in July 2015.

""A disgraceful verdict in the Kate Steinle case! No wonder the people of our Country are so angry with Illegal Immigration,"" the President tweeted.

A disgraceful verdict in the Kate Steinle case! No wonder the people of our Country are so angry with Illegal Immigration. — Donald J. Trump (@realDonaldTrump) December 1, 2017

Sessions used the verdict to urge local officials to cooperate with federal law enforcement agencies.

""When jurisdictions choose to return criminal aliens to the streets rather than turning them over to federal immigration authorities, they put the public's safety at risk,"" he said in a statement.

But one of the defendant's lawyers said the debate over immigration didn't belong in the case.

""From day one, this case was used as a means to foment hate, to foment division and to foment a program of mass deportation,"" public defender Francisco Ugarte said.

""Nothing about Mr. Garcia Zarate's ethnicity, nothing about his immigration status, nothing about the fact that he is born in Mexico had any relevance as to what happened on July 1, 2015.""

Assistant District Attorney Alex Bastian said prosecutors were disappointed by the verdict but respected the jury's decision.

""I can't stress this enough, this really is about the Steinle family. They've shown incredible resolve in this whole process,"" he said. ""Our hearts go out to them.""

The case

Prosecutors said Garcia Zarate deliberately fired into an unsuspecting crowd on the pier, killing Steinle as she walked with her father.

But the defense attorney said the shooting was accidental, and the bullet ricocheted off the ground and traveled about 80 feet before hitting Steinle.

Garcia Zarate faced a charge of second-degree murder, but jurors were allowed to consider first-degree murder and involuntary manslaughter convictions.

The jury deliberated for six days before issuing its decision.

Differing accounts

Defense attorney Matt Gonzalez said Garcia Zarate found the gun at the pier. He said it was wrapped in cloth, and when he unwrapped it, it accidentally discharged.

But in a police interrogation, Garcia Zarate admitted to firing the gun, saying he was aiming at a seal. He also told police that he stepped on the gun, causing it to fire.

Juors began deliberating Tuesday in the murder trial of Jose Ines Garcia Zarate.

Prosecutors said Garcia Zarate immediately tried to cover his tracks by throwing the gun into the San Francisco Bay, then fleeing the scene.

Garcia Zarate was formerly known as Juan Francisco Lopez-Sanchez, one of several aliases he is known to have used. CNN and other media outlets previously identified him as Juan Francisco Lopez-Sanchez.

Immigration debate

Steinle's death reignited the debate over immigration and what role sanctuary cities should play in policy enforcement.

JUST WATCHED Officials sued after Kate Steinle's death Replay More Videos ... MUST WATCH Officials sued after Kate Steinle's death 02:00

In 2015, Freya Horne, chief legal counsel to the San Francisco County sheriff, said Garcia Zarate was let go because there was no legal cause to detain him.

Steinle's family sued last year, alleging that San Francisco and its former sheriff were partly to blame for her death because officials never notified Immigration and Customs Enforcement when Garcia Zarate was released from a local jail in April 2015.

City officials have said they're not liable for a former inmate's actions. A federal judge dismissed the family's claims.

The Justice Department is considering bringing federal charges against him, according to DOJ spokeswoman Sarah Flores.

The sheriff's department said there is a federal criminal warrant that was signed by a US district judge in 2015 for Garcia Zarate. Once he is eligible to be released, the US Marshals will be notified, authorities said.

Documents unsealed Friday show the warrant was issued in July 2015 after Steinle was killed. An amendment filed Friday adds other violations, including conviction for being a felon with a firearm.",REAL
"Vermont senior tested ricin recipe on retirement community residents, feds say","Story highlights A criminal complaint says the woman was using neighbors to test the potency

She is in custody; attempts to reach her lawyer were unsuccessful

(CNN) The cupboard above the stove in Betty Miller's retirement apartment contained bottles labeled ""apple seed,"" ""cherry seed,"" ""castor beans,"" and ""ricin,"" the FBI says.

The potentially deadly ricin, federal agents allege, was homemade by the 70-year-old to go into the food and drink of her neighbors at a Vermont continuing care retirement community.

Earlier this week, the FBI was asked to come to the Wake Robin life care community in Shelburne, Vermont, to investigate a potentially toxic substance.

When an agent interviewed Miller, she allegedly told him she was making ricin in her home and testing its effectiveness on other residents of Wake Robin.

""On at least three occasions, Miller exposed other residents to the ricin she had produced by placing it on food and/or in beverages she expected them to ingest,"" Special Agent Mark Emmons wrote in a criminal complaint.

Read More",REAL
How Kate Steinle's case became one of the biggest trials of the year,"Fewer still had heard of Kate Steinle, a 32-year-old medical device sales representative living in San Francisco.

But those two topics have become closely linked since then. And the acquittal Thursday of an undocumented immigrant in her 2015 death became viral breaking news and set off a series of fiercely critical reactions from leading Republican voices across the US.

President Donald Trump called the verdict ""disgraceful."" Attorney General Jeff Sessions said the death was ""preventable"" and said San Francisco's sanctuary city policies were to blame. Breitbart News for a time on Friday morning focused the top nine stories on its homepage to the verdict, and the hashtag #BoycottSanFrancisco became one of the top trending topics in the US on Twitter.

Why was there such a big reaction to this young woman's death? And how did a murder trial in California become one of the most important criminal cases of the year?

Steinle's case broke through to larger awareness because it touched on several hot-button issues that have recently come to prominence.

And that story largely begins -- as most in today's era do -- with Donald J. Trump.

""For Donald Trump, we were just what he needed -- beautiful girl, San Francisco, illegal immigrant, arrested a million times, a violent crime and yadda, yadda, yadda,"" Steinle's mother, Liz Sullivan, told the San Francisco Chronicle in September 2015 . ""We were the perfect storm for that man.""

San Francisco immigration policy

Prosecutors argued that Kate Steinle, left, was shot and killed by Jose Ines Garcia Zarate.

On July 1, 2015, Steinle was walking on a busy pier of the Embarcadero district in San Francisco when she was killed by a single bullet to the chest.

The man arrested, Jose Ines Garcia Zarate, 45, was an undocumented immigrant from Mexico who had been deported from the US five times previously, according to officials.

He might have been deported a sixth time for a drug-related warrant, as Immigration and Customs Enforcement requested an immigration detainer and that the agency be notified before he was released.

But officials in San Francisco released Garcia Zarate from custody in April instead of turning him over to immigration authorities. San Francisco is a ""sanctuary city,"" a term that broadly refers to a city that in some way does not cooperate with federal immigration enforcement.

At the time, though, the term "" sanctuary city "" was not well known. A Google Trends query shows the phrase was rarely searched -- until a sharp spike in July 2015.

Trump picks up the story

Two weeks earlier, Trump had launched his presidential campaign by criticizing US border security, saying that Mexico was sending criminals and ""rapists"" to the US.

The comments faced harsh criticism from leaders across the political spectrum. Sen. Marco Rubio, his opponent in the Republican primary, said his comments were ""not just offensive and inaccurate, but also divisive.""

Steinle's killing came two weeks later. Trump's first tweet about Steinle on July 3 was to offer his "" heartfelt condolences "" to her family. Less than an hour later, he directed his anger at Rubio.

"".@MarcoRubio what do you say to the family of Kathryn Steinle in CA who was viciously killed b/c we can't secure our border? Stand up for US.""

.@marcorubio what do you say to the family of Kathryn Steinle in CA who was viciously killed b/c we can't secure our border? Stand up for US — Donald J. Trump (@realDonaldTrump) July 3, 2015

In a statement at the time, Trump said Steinle's shooting was further proof of the need for a border wall.

""This senseless and totally preventable act of violence committed by an illegal immigrant is yet another example of why we must secure our border immediately,"" Trump said in a statement. ""This is an absolutely disgraceful situation and I am the only one that can fix it. Nobody else has the guts to even talk about it.""

Talk about it he did. Trump repeatedly brought up Steinle's case on the campaign trail. In his speech accepting the Republican presidential nomination , he said he was deeply affected by the stories of parents whose children were killed by undocumented immigrants.

""My opponent will never meet with them, or share in their pain. Instead, my opponent wants sanctuary cities,"" he said. ""But where was the sanctuary for Kate Steinle?""

Other Republicans legislators took his cue. This June, the House of Representatives passed ""Kate's Law,"" a bill that would create harsher penalties for repeat illegal entry to the United States and would expand US law to pressure local cities to cooperate with federal immigration enforcement. The bill has since stalled in the Senate.

The Steinle family's wishes

Garcia Zarate listens in court during his trial in the killing of Kate Steinle.

Lost amid the heightened debate about the case's impact on immigration policy was, well, the evidence and arguments presented in court.

Prosecutors said Garcia Zarate intentionally and recklessly fired into a crowd on the San Francisco pier that day, killing Steinle. But his defense attorney said the shooting was accidental and emphasized evidence that the bullet ricocheted off the ground and traveled about 80 feet before hitting Steinle.

One of the defendant's lawyers said the debate over immigration didn't belong in the case.

""From day one, this case was used as a means to foment hate, to foment division and to foment a program of mass deportation,"" public defender Francisco Ugarte said after the verdict.

In court, there was no mention of the defendant's immigration status, or his past criminal convictions, or San Francisco's immigration policy. Jurors were asked to decide the question: Was there evidence beyond a reasonable doubt that the shooting was intentional?

Similarly, the widespread focus on Steinle's case often had little to do with the family's wishes.

""Sensationalizing it is not the route we would like to go,"" he said. ""If you're going to use somebody's name and you're going to sensationalize the death of a beautiful young lady, maybe you should call and talk to the family first and see what their views are.""

Trump did speak to the Steinle family after that, telling CNN he wanted to leave a period of grieving first.

Even now, the Steinle family has continued to shy away from the spotlight, and have mostly spoken to John Diaz of the San Francisco Chronicle . The Steinles said they were not involved in ""Kate's Law"" and did not know who named it after their daughter.

They also said they were not opposed to sanctuary cities, although they thought San Francisco's then-sheriff went about it the wrong way.",REAL
"For the first time since the end of the Cold War, Hawaii will test nuclear sirens","Story highlights Nuclear warning test will be included as part of regular statewide siren test

An estimated 18,000 Hawaiians would be killed in a nuclear strike, state agency says

(CNN) Hawaii is taking those threats from North Korea seriously.

Starting Friday, the state will start monthly testing of a nuclear warning siren system aimed at alerting residents to an impending nuclear missile strike. It's the first such tests in the Aloha State since the end of the Cold War.

The test of the nuclear warning siren will be conducted during the monthly tests of the overall statewide warning siren system, according to the Hawaii Emergency Management Agency.

At 11:45 a.m. on the first business day of every month, a steady alert signal will blare from speakers for 50 seconds, followed by a 10-second pause and then a wailing ""attack warning"" signal for 50 seconds.

In the event of an actual attack, Hawaii's 1.4 million residents are expected to seek shelter immediately after hearing the attack warning signal. An emergency alert system will broadcast warnings on TV and radio as well.

Read More",REAL
