"Chicago police tout 14% homicide drop, and concede there's more to do","(CNN) Chicago police Friday touted a 14% drop in homicides so far this year compared with an exceptionally bloody 2016, saying staffing investments and other strategies are reducing the kinds of violence that left some neighborhoods in despair.

Still, the number of killings in the nation's third-largest city in 2017 remains higher than in almost any other year of the past decade -- and Chicago Police Superintendent Eddie Johnson said his officers know there's more to do.

""I would say ... we're making progress ... But it's going to take time to root out everything we need to do,"" Johnson told reporters Friday outside a church on the city's southwest side.

The city's homicide total so far this year is 609, police say. That's a 14% decline from this point last year when there had been 710 homicides. The year 2016 ended with 771 homicides.

Johnson also highlighted the following police-compiled stats for the year's first 11 months as evidence the Windy City is making strides:

• 703 fewer shootings reported to police, a 21% decline from this point in 2016;

• 798 fewer shooting victims, a 20% decline.

But while the number of killings may be down this year from last, this year's 609 homicides already total well above most annual tallies in Chicago for the past decade.

""It's important to keep in mind these numbers aren't a spike of the football by any means,"" but an indication progress is being made, Johnson said.

Still, Johnson and community activists acknowledged that current crime levels still sow fear in neighborhoods.

""It's great there's a slight decrease from last year, but let's not forget that last year was the worst in 20 years,"" Father Michael Pfleger, pastor at Saint Sabina Church and an activist on Chicago's South Side, told CNN.

""Let's not use the barometer of last year. Let's look over the last three or four years. Hell, anything should look good next to last year.""

Chicago also has been a frequent target of criticism for President Donald Trump, who has talked and tweeted about rampant crime and the failure to fight gun violence there.

""It's worse than some of the places that we read about in the Middle East,"" Trump said in February.

Crime-fighting investments made

The 771 homicides in 2016 represented a considerable spike over 2015. It was the largest single-year homicide increase in 25 years among the five most populous US cities, according to the Justice Department.

The Chicago Tribune, which tracks homicides in the city, has a slightly higher count for 2017 than the police department: 624, as of Friday. The Chicago Police Department uses slightly different criteria when compiling its tally. For example, CPD does not include killings that occurred on area highways, or those where police are involved and it is determined to be a justifiable homicide.

Between 2007 and 2015, the number of yearly homicides in Chicago hovered between 400 and just about 500

Johnson said certain investments, including technology, have helped police tackle crime this year.

That includes putting ""strategic decision support centers"" in neighborhoods that have struggled with violence, he said.

Those centers use predictive crime software that helps police commanders decide where to deploy officers. They also provide ""additional cameras, gunshot detection systems, and mobile phones to officers in the field who receive real-time notifications and intelligence data at their fingertips,"" Chicago police say on their website.

The centers are staffed by officers and analysts with the University of Chicago's Crime Lab.

""Officers who used to patrol randomly are now more focused on where to be,"" said Kim Smith, a Crime Lab research manager. ""Being in the right place at the right time is crucial, especially somewhere like Chicago, where there are ever-changing gang conflicts. ... We're trying to use data to shed some light where your resources are the most effective.""

The high-tech centers are currently in place in six of the city's 22 police districts, Smith said. Those six district last year accounted for more than half of city's shootings but only 25% of the population.

""I cannot say with 100% certainly that the (support centers) are leading to all the reductions we're seeing,"" she said. ""But I do think the processes and the use of technology ... are really driving either a shift in the way the policing is done in Chicago that as a result leads to these reductions, or just getting people excited about a new initiative that seems to be working.""

The department also is in the midst of a hiring spree that will see the roster grow by 1,000 officers, Johnson said.

The task force includes an additional 20 ATF agents, as well as 12 Chicago police officers, two Illinois state troopers, six intelligence analysts and state and federal prosecutors.

Rooting out police corruption

The police department has been plagued in recent years by corruption scandals, and a Justice Department investigation in 2016 found that it unconstitutionally engaged in a pattern of excessive force and had severely insufficient training and accountability procedures.

""If we take the route of just the new technology and do not equally push the human connection, I believe we'll hit a dead end sooner or later,"" Pfleger said. ""You have to have relationship building in the community.""

Indeed, mistrust in the police has been a major factor in the city's soaring crime rate, University of Chicago law professor Craig Futterman said.

""The biggest thing that they can do now would be improving accountability, transparency and honesty and do the kinds of things necessary to build trust,"" he said, though he noted that police cannot solve every problem that contributes to crime.

""The biggest things that I've seen in my work that drive violence in Chicago are the absence of hope, opportunity, jobs and the lack of police accountability,"" Futterman added. ""Jobs, hope and opportunity are not within the control of the police department.""

'See us in a new light'

Homicides were down 44% in the city's impoverished and notoriously deadly Englewood neighborhood -- the first police district to use the new support-center technology, police said.

Greater community outreach also contributed to the decline in crime, Kenneth Johnson, the district commander, told CNN.

""We're not just standing apart being spectators,"" he said. ""I want the community ... to see us in a new light. We've been on the path for the past year of making sure the community knows us, that they trust us and believe in us.""

Dr. Gary Slutkin, founder and executive director of the organization Cure Violence, which takes a public-health approach to violence prevention, said residents and community groups should also get credit for the reduction in homicides, however slight.

He said his organization and others have ""violence interrupters"" on the streets of the roughest neighborhoods to intervene in gang conflicts before they escalate. The outreach workers, some of them former gang members, stay in touch with friends and relatives of shooting victims in an attempt to prevent retaliation.

""Under the crisis that Chicago had the last two and half years, people have stepped up,"" he said. ""The city, the state, philanthropy, the community groups have stepped up. It's not the most dramatic reduction yet but it's going to be. Next year is going to be much better.""

Even once-skeptical Englewood residents like activist Jahmal Cole acknowledge the benefits of the new policing strategy.

""I hated the idea of police watching us like hawks. But you can't argue with a decline like this,"" Cole, founder of the nonprofit My Block, My Hood, My City, said of the numbers for homicides and shootings.

Neighbors' lax gun laws cited

Though Chicago has a reputation as a murder haven, it didn't have the nation's highest per-capita (murders per 100,000 people) homicide rate. In 2015. Thirteen large cities -- population 250,000 or more -- had higher murder rates . That didn't include a host of midsized cities with more murders per 100,000 residents.

Also, cities such as Atlanta; Washington; Oakland, California; Memphis, Tennessee; and Kansas City, Missouri, all had higher violent crime rates in 2015.

But Chicago's numerical murder rate has been higher than that of the country's two larger cities , Los Angeles and New York. Johnson was asked whether Chicago's reputation as a violent place bothered him.

""It's frustrating, because when you look at the crime in Chicago, we have our challenges. We have our gun violence,"" he said. ""Chicago is so big that we get a lot of attention because New York and L.A., quite frankly, are seeing bigger reductions than we are.""

Lax gun laws in surrounding states also put Chicago at a disadvantage, compared with New York and Los Angeles, Johnson said.

""We're sitting between Wisconsin and Indiana, who have very lax gun laws, so the illegal flow of guns coming into this city is a lot larger than theirs,"" he said. ""That just means we have more illegal guns on our streets.""",REAL
"Chicago gang members seek new lives through writing, reading memoirs","Chicago (CNN) Just days before his daughter's first birthday in 2006, Leronn Johnson was shot once in the shoulder and twice in his back. He says the bullets remain inside his body, a permanent reminder of the gang life he was part of growing up on the streets of Chicago.

""My shirt went from fresh white to blood red,"" Johnson says. ""Ambulances and firefighters is all I heard.""

On a recent night in Chicago, Johnson was joined by a dozen other former gang members and at-risk African American men in their 20s who are trying to escape gang life.

They're part of a voluntary rehabilitation program that includes writing and reading their own memoirs.

'New Beginnings'

Sitting on a tall director's chair under a spotlight, Johnson read from his memoirs, which he titled ""New Beginnings,"" in front of an audience of more than 100 people.

""It saddens me to have to wake up every day and see these wounds on my body,"" Johnson read into the microphone. ""What if I retaliated and put myself in a hole, which would prevent me from seeing my daughter?""

Former gang member Bruce Knights read from his memoirs he titled ""The Deepest Truth.""

""Why do we live in a world together but yet feel alone? Who truly understands why? Does the pain I receive define who I am? Do I live in a fantasy, or is reality so real that I wish I was living in one?""

Writing and reading their memoirs is part of a program called CRED, or Creating Real Economic Destiny, which places the young men in ""cohort"" groups while teaching them job skills, providing intensive life and trauma coaching, and tutoring toward their high school diploma or GED.

CRED says the memoirs idea came from a program in El Salvador that began in 2012. It targeted gang-affiliated young people in public schools, prisons and juvenile detention centers, with the published works used to engage with families, guards and the general public. The homicide rate in El Salvador hovers around 69 per 100,000. Chicago's rate is about 15 per 100,000.

JUST WATCHED Former inmate wants to end gun violence Replay More Videos ... MUST WATCH Former inmate wants to end gun violence 01:25

The Chicago program was launched last year by the Emerson Collective and former US Education Secretary Arne Duncan, who moved back to Chicago after his years working in the Obama administration to find that violence in the city had gotten worse, not better. Duncan, the former CEO of Chicago Public Schools, was part of the audience listening to the men read from their memoirs.

""It's emotional. It's inspiring. It's heartbreaking, but these are remarkable young men, who are telling unbelievable truths and making themselves vulnerable,"" Duncan told CNN.

An honest day's work

The training can last up to 18 months and some of the young men, who had been making thousands of dollars selling drugs on the street, now arrive at learning sessions at 7 a.m. as they work toward getting jobs in manufacturing, retail and construction that pay $12 to $20 an hour.

Duncan said the group's goal, which includes bringing former rival gangs together to try and form a ""brotherhood,"" is simple: ""We want to make Chicago safer, we want to reduce shootings, we want to reduce the homicides. And we work directly with the young men in the communities who are most likely to shoot or be shot.""

Duncan admits that fixing the problem isn't easy. He calls the program ""a work in progress,"" but says he's encouraged by early signs.

""Some of the guys from the first cohort are now mentoring, supervising the other cohorts,"" he said.

""I know we are keeping guys alive. I know we are preventing retaliations, but as a city we have a long way to go.""

JUST WATCHED Top 10 CNN Hero Jennifer Maddox Replay More Videos ... MUST WATCH Top 10 CNN Hero Jennifer Maddox 02:24

Dressed in a black suit, crisp shirt and neatly fitting tie, Lonnie Williams read from his memoirs, ""New Steps and New Moves,"" which described what it was like being raised by an aunt.

""Until this day I can't decide what made me lose respect for my aunt. But between watching her snort coke and being locked in the basement the majority of my childhood, who could blame me? So I left.""

Williams later moved in with his sister and struggled to get by. In his memoir, which he read to an audience that included family and friends, as well as strangers, he said, ""My brother was selling crack, so I chose that as a means to survive.""

After watching his uncle get sentenced to a long prison term, and having a son of his own, Williams is now part of the CRED program in hopes of finding an ""honest life.""

""I think about the 35 years my uncle just got,"" he read, pausing occasionally to look up at the audience. ""Or that my son asks me, 'Dad, why you keep leaving me?' or 'Why don't you love me?' I would be speechless. Although my moves are to protect his future, I also have to remember that I'm a big part of his present. He is getting older and so am I. And to be part of the solution, I have to stop being part of the problem.""",REAL
A force for change: Coping with grief through activism and advocacy,"(CNN) Every tragedy, big or small, leaves behind victims and loved ones whose lives are inalterably changed. In some cases, survivors find themselves driven to become activists or advocates, finding meaning in the tragedy by fighting whatever caused it.

There are many examples making headlines all over the country.

Chris Hurst was an evening news anchor at WDBJ in Roanoke, Virginia, when his girlfriend, Alison Parker, a reporter, and her cameraman, Adam Ward, were shot and killed during a live interview one morning in August 2015

Eventually, Hurst left his spot at the anchor desk, inspired to run for office and address some of the issues that led to Parker's death -- though he stresses he's not a single-issue candidate, and gun control wasn't a focus during his campaign.

Also this week, the uncle of Philando Castile -- a black man killed by a police officer last year during a traffic stop -- became a reserve officer in St. Paul, Minnesota . He plans to help be the change he wanted in the department and his community.

Mary Fetchet, a clinical social worker who lives in New Canaan, Connecticut, lost her son, Brad, in the terror attack on the World Trade Center on September 11, 2001.

When she visited the family assistance center in New York City, set up to provide aid to victims' families, Fetchet said she was ""struck by the magnitude of the event, seeing thousands of families coming from around the country and around the world.""

It was that experience, in part, that led Fetchet to start Voices of September 11th , an organization that works to provide resources to, and address the needs of, September 11 survivors, first responders and victims' families.

""When I think about how it's changed my life, I almost see my life in two chapters,"" Fetchet told CNN. ""Before 9/11 and after 9/11.""

But what drove these people, in the midst of their grief, to try to be the force for change?

Making sense of the insensible

David Kessler, an author, grief expert and founder of Grief.com, told CNN that these families have undergone what he calls the sixth stage of grief: ""Finding meaning.""

""We come away from something so devastating that we go, 'The story just can't end this way,'"" Kessler said. ""Their life needed to matter, and their death needed to have some meaning, so for many people, that spurs us into action.""

Dr. Robin Gurwitch, a professor of psychiatry and behavioral sciences at Duke University who has spent most of her career studying the effects of trauma on children, agreed with Kessler's assessment that some people who deal with a traumatic, insensible loss are looking to find meaning in their suffering.

In the aftermath of a traumatic loss, Gurwitch said, people ask themselves, ""What are some things I can do to honor the life of the person that's no longer here?""

Sometimes that's done by drawing attention to the things that caused the traumatic death, she said.

There are those like John Walsh , who founded the National Center for Missing and Exploited Children and started the TV show, ""America's Most Wanted,"" after the abduction of his 6-year-old son, Adam, in 1981. Walsh now hosts CNN's ""The Hunt with John Walsh.""

More recently, Mothers of the Movement , a group of mothers who have lost their children to police violence, are advocating for reform at the cross section of race and policing. During the 2016 Democratic National Convention, they stumped for Hillary Clinton.

But Gurwitch points to the families of children killed in December 2012 at Sandy Hook Elementary as examples of people who have made sense of their children's deaths by using their experience to help others. Many of those families started a foundation, she said, focusing on a different piece of what contributed to the loss of their child.

Such causes ""help in terms of recovery and resilience,"" Gurwitch said, but ""there's still going to be those times that are going to be challenging, that are going to be hard.""

Memorializing their loved ones

When people are pushed into advocacy or social work as a result of a traumatic loss, part of the benefit for those affected is in keeping busy, but it's also a way to memorialize their loved ones, explained Joanne Cacciatore, an associate research professor at Arizona State University who studies traumatic grief.

""In my research, one of the reasons that parents most want to get active in volunteering and doing things has to do with remembering, honoring and making sure that the world doesn't forget -- not only this terrible thing that happened, but also the beautiful person (that was lost),"" she said.

In 1996, two years after her own daughter died, Cacciatore started the MISS Foundation , which offers support to families who have experienced the death of a child.

The foundation and ""random acts of kindness"" were the best way to remember her daughter, she said.

""For me, really, compassion was the most powerful thing,"" Cacciatore said. ""It just felt like that was the only way I would survive it.""

Helping others through their experience

Cacciatore isn't alone in feeling that her ability to help others helped her. Some people benefit from altruistic acts, like reaching out to others after a loss, Gurwitch said.

""We know that when people are really struggling, even though you're hurting, if you reach out and try to help someone, it helps you do better,"" she said.

It could be as simple as writing a letter to first responders in your community who were first on the scene of the tragedy, or something as big as creating a foundation to change how the public considers gun control or mental health services, Gurwitch said.

Fetchet, whose son was killed in the 9/11 attacks, said that because of her background in social work, she felt she was ""in a unique position, because I had an understanding of the impact of traumatic events.""

""I almost felt like I had an opportunity and a responsibility to make a difference,"" she said.

'Creating a new future'

Kessler, who dealt with the loss of his 21-year-old son more than a year ago, said the people who are able to move forward and find meaning in their loss are the ones who are ""creating a new future.""

""That loss can paralyze you,"" he said. ""But it can also help you grow in ways that you never thought.""

Fetchet echoed this sentiment. As awful as losing Brad was, his death prompted a change in her life's work, and she's proud of the ""great strides"" she and others affiliated with the Voices of September 11th have been able to make in developing the 9/11 memorial and providing help to victims of the tragedy.

""The loss of my son has had a profound impact on me,"" Fetchet told CNN. ""It was certainly a life-changing event that in a sense expanded my life's journey, personally and professionally.""",REAL
