Author: Trump made 'p-word' comment in 2000,"(CNN) According to a golf writer, then-citizen Donald Trump in 2000 reportedly offered a vulgar commentary on a woman passing by, and did so with little regard for who might overhear.

Writer Michael Corcoran told CNN's Erin Burnett during a Friday interview that Trump made the remark to him during a 36-hour visit to Mar-a-Lago 17 years ago,

""We just finished playing golf, and we were sitting around on the outdoor patio area, eating area, at the golf club,"" said Corcoran, who was in Florida working on a profile on Trump. ""An attractive young woman walked by and he sort of ... sighed and said, 'There's, you know, there's just nothing in the world like first-rate p-word.'""

In his aired interview, Corcoran paused before saying ""p-word,"" indicating he was sanitizing what he says Trump actually said.

According to Corcoran, there was no secrecy about the remark, and it could have easily been heard by any number of people in the general vicinity.

Read More",REAL
Sources: Kushner was the 'very senior' transition member,"The court documents provide the clearest picture yet of coordination between Flynn and other Trump advisers in contacting Russian officials to influence international policy, and raise questions about who higher up the chain of command in Trump's orbit -- possibly even including the President himself -- is in Special Counsel Robert Mueller's sights after he agreed to a plea deal with the retired general

The revelations also undermine Trump's often repeated contention that the Russia investigation is little more than a witch hunt being perpetrated by his political enemies.

A person familiar with the transition's effort on the UN vote said it was well-known and a collaborative effort by various transition officials, including Reince Priebus, Steve Bannon, Flynn and Kushner, adding that none of them ""ordered"" or ""directed"" the others and all were working towards the same goal of standing by Israel.

In court, prosecutors detailed calls Flynn had made in late December 2016 to the senior Trump transition team at Mar-a-Lago to discuss conversations with then-Russian Ambassador to the United States Sergey Kislyak.

The document also says Flynn falsely said he did not ask Kislyak to delay the vote on the UN Security Council resolution.

Flynn faces a maximum sentence of five years in prison, according to federal sentencing guidelines, though the judge Friday morning stressed he could impose a harsher or lighter sentence.

Flynn's plea agreement stipulates that he will cooperate with federal, state or local investigators in any way that Special Counsel Robert Mueller's office might need, according to a document filed in court Friday. He could also be required to participate in covert law enforcement operations, such as wearing a wire, if asked or to share details of his past dealings with the Trump transition team and administration.

Kushner met earlier this month with Mueller's team as part of the investigation into Russia's meddling in the 2016 US election, according to two people familiar with the meeting.

""Mr. Kushner has voluntarily cooperated with all relevant inquiries and will continue to do so,"" Abbe Lowell, Kushner's lawyer, told CNN on Wednesday.

The conversation lasted less than 90 minutes, one person familiar with the meeting said, adding that Mueller's team asked Kushner to clear up some questions he was asked by lawmakers and details that emerged through media reports. One source said the nature of the conversation was principally to make sure Kushner doesn't have information that exonerates Flynn.",REAL
Tom Hanks: Full support for Hollywood sexual abuse victims,"(CNN) Tom Hanks gave his take on sexual harassment in Hollywood Saturday, noting simply that ""it's everywhere,"" and adding that he hopes ""repercussions land exactly as they should.""

Hollywood has always been a breeding ground for bad behavior, the veteran actor told CNN's David Axelrod on CNN's ""The Axe Files,"" airing Saturday at 7pm ET.

""In a lot of ways we all left town and joined the circus, and the circus is glamorous in a lot of ways. And there is camaraderie and there is sex and there's attraction and there's boyfriends and girlfriends and there's flirting and that's always been part of ... there's on-set affairs,"" Hanks said.

But recent revelations -- which have seen many high-profile Hollywood players, from Harvey Weinstein to Louis CK to Kevin Spacey, accused of sexual harassment and assault -- go ""much farther beyond that,"" he emphasized

""It ends up being a swaying of influence and it becomes part of the marketplace,"" Hanks told Axelrod.

Read More",REAL
The Senate is about to vote on a tax bill few have read,"Republicans say they have the votes! They're going to pass a massive tax reform bill Friday night that would permanently lower corporate tax rates and undo the Obamacare individual coverage mandate. And a bunch of other stuff. We're not exactly sure about everything it would do yet. Why? Because we haven't read the tax reform bill.

Few have. Even the lawmakers who are about to vote on it. It was still being written, at times in cursive, on the night of the vote.

That didn't keep holdout Republicans from signing on to the bill throughout the day.

Sens. Jeff Flake of Arizona and Susan Collins of Maine said they'd vote yes, virtually assuring passage, probably later Friday night.

That lack of transparency has turned into one of Democrats' major lines of attack in debate on the Senate floor and on social media.

Republicans plan to use special budget rules to pass the tax package using only 50 votes and bypassing a filibuster. Those rules are supposed to help lawmakers reconcile budget deficits, and Republicans have found a way to keep them even though congressional budget scorers said Thursday that the legislation would add $1 trillion to the deficit

Democratic Sen. Claire McCaskill of Missouri tweeted a photo of amendments that she said would be added to the bill but at that point that she had not seen.

""This is so bad. We have just gotten list of amendments to be included in bill NOT from our R colleagues, but from lobbyists downtown. None of us have seen this list, but lobbyists have it. Need I say more? Disgusting. And we probably will not even be given time to read them.""

This is so bad. We have just gotten list of amendments to be included in bill NOT from our R colleagues, but from lobbyists downtown. None of us have seen this list, but lobbyists have it. Need I say more? Disgusting. And we probably will not even be given time to read them. pic.twitter.com/Mn0i56JeZg — Claire McCaskill (@clairecmc) December 1, 2017

The broad outlines of the legislation are known, but there were last-minute tweaks being made as Republicans sought to get to the 50 votes they'd need.

""This is a really bad bill for my constituents. I think. Because I will not have time to read it before I am forced to vote on it,"" Democratic Sen. Chris Murphy of Connecticut said on the Senate floor Friday evening.

A lot of this is theater. It's no great secret that most lawmakers don't sit down personally with a highlighter and read the final text of a bill. Details are meant to be hashed out over the course of weeks. But this massive piece of legislation has been pushed at lightning speed, and largely without input from Democrats, who had signaled their united opposition to it.

And the bill senators are likely to pass won't become law. Probably not, anyway. It'll have to be reconciled with the competing bill passed by the House, unless the House decides to take up the Senate version.

When Sen. Ron Wyden, an Oregon Democrat, complained about the situation to Senate Majority Leader Mitch McConnell on the Senate floor, McConnell argued that Democrats would have ""plenty of time"" to read it and that they know most of what's in there anyway.

""There were four days of hearings in the committee,"" the Kentucky Republican said. ""The report has been out at least two weeks. I'm totally confident our friends on the other side are fully familiar with almost all aspects of this and the final version he'll certainly have an opportunity to read, but he's very familiar with the various parts of this. He had plenty of time to look at it in committee, and as I said, there will be plenty of time to read the final version of it before the vote.""

McConnell said that at just after 3 p.m. ET. But still, there was no final text.

House Minority Leader Nancy Pelosi, a California Democrat, tweeted to McConnell, ""@SenateMajLdr, if you are so intent on forcing middle-class families to foot the bill so your donors can have a tax break, at least have the decency to find a printer. #GOPTaxScam""

.@SenateMajLdr, if you are so intent on forcing middle class families to foot the bill so your donors can have a tax break, at least have the decency to find a printer. #GOPTaxScam pic.twitter.com/qFkfaru6ml — Nancy Pelosi (@NancyPelosi) December 1, 2017

A bit before 7 p.m., Sen. Dick Durbin of Illinois said Democrats had been handed a new version, and he hoisted a 479-page stack of documents.

""479 pages were handed to us,"" Durbin said. ""They tell us that some of this has been around for awhile. Some of it's new. They don't tell us which part is new and which part is old,"" he complained, before picking up a specific page of the legislative text where a staffer had scrawled provisions in cursive.

""We're not even teaching cursive in a lot of schools anymore but someone on the staff knew it to try,"" Durbin said. ""The problem is they wrote it in cursive on the margin here. ... I defy anybody to read it because the problem is when they copied it they chopped off lines so there aren't full sentences.""

Collins, the Maine Republican and a swing vote, did not mention the text when she tweeted about her decision to support the bill.

""After securing significant changes, as well as commitments to pass legislation to help lower health insurance premiums, I will cast my vote in support of the Senate tax reform bill,"" she wrote, before a series of tweets about the changes she recently secured. They're having to write those in before the vote later Friday night.",REAL
#2020Vision: Sanders hits the road; Gutiérrez 'entertaining' 2020 run; Biden 'would say no' right now,"(CNN) Our weekly roundup of the news, notes and chatter about the prospects for the next Democratic presidential race:

Vermont Sen. Bernie Sanders never really stopped campaigning. He's leaving Washington again Friday for a swing through Kentucky, Ohio and Pennsylvania for a series of rallies against the Republican tax plan.

The road trip will bring together MoveOn, which teamed with Sanders for pro-Obamacare events earlier this year, and the political organization spawned from Sanders' 2016 campaign, Our Revolution.

Next Wednesday, Sanders will be in Baltimore for a rally with Maryland gubernatorial candidate Ben Jealous. There the former NAACP leader, who already has the backing of Our Revolution, will announce his own statewide ""Medicare for all"" plan.

It all comes after a week in which Sanders endorsedin the race to replace retiring (presidential contender?) Illinois Rep.. No surprise there — Sanders backed Garcia's 2015 (nearly successful) challenge to Chicago Mayor. And Garcia supported Sanders early on in the 2016 Democratic primary. It's mostly notable because Sanders picked so quickly between his allies: 2016 convention delegate and Chicago Alderman, a member of the Democratic Socialists of America, is also running in the primary . If Garcia wins, he'll be out of the mayoral mix in 2019, when he was expected to take on Emanuel again — something that had Chicago politicos chattering.

Republicans are paying attention to Sanders, too. The GOP opposition research firm America Rising this week sent a fund-raising email headlined ""President...Bernie Sanders?""

Randi Weingarten. And he's been meeting with international affairs experts such as Bill Perry, a defense secretary in the administration of President Bill Clinton, around a series of speeches designed to define his international vision, one year after running a campaign heavy on domestic policy and light on the rest of the world."" A notable look at Sanders' recent moves comes from Politico's Gabriel Debenedetti , who reports: ""Sanders has been working closely with figures who are close to the party establishment he's long railed against, like American Federation of Teachers President. And he's been meeting with international affairs experts such as, a defense secretary in the administration of President, around a series of speeches designed to define his international vision, one year after running a campaign heavy on domestic policy and light on the rest of the world.""

News and notes:

Joe Biden sat down with NBC's Al Roker for a book talk this week, and here's what he had to say about 2020: ""If the Lord Almighty came down right this moment, I gave him my word as a Biden, and said the nomination is yours, but you have to take it right now, BIDEN 'WOULD SAY NO' RIGHT NOW: Former Vice Presidentsat down with NBC'sfor a book talk this week, and here's what he had to say about 2020: ""If the Lord Almighty came down right this moment, I gave him my word as a Biden, and said the nomination is yours, but you have to take it right now, I would say no .""

John Kerry is in Iowa on Friday. He's hitting a campaign event for Attorney General Tom Miller at the Waveland Golf Course in Des Moines, in KERRY IN DES MOINES: Former secretary of state and 2004 Democratic presidential nomineeis in Iowa on Friday. He's hitting a campaign event for Attorney Generalat the Waveland Golf Course in Des Moines, in his first trip to the state in years

GUTIÉRREZ A 2020 PROSPECT? Retiring from his seat representing Illinois in the House, Rep. Luis Gutiérrez is ""at least entertaining the idea of running for president,"" a source familiar with his thinking tells me. ""The very short answer is, he hasn't ruled anything out,"" the source said, pointing to Gutiérrez's news conference announcing his retirement in Chicago on Tuesday and noting that he plans to travel the country ""and energize immigrant and Latino voters."" The source said Gutiérrez plans to visit Western and Southern states — not the typical Iowa and New Hampshire route for presidential prospects — to engage the immigrant, Latino and Puerto Rican communities.

""I'm kinda excited about Luis. He's awesome and can bring something real to the debate. Don't know his chances but he's not a slouch, and is probably one of the more known Latino figures in the country,"" one Democratic strategist emailed me. That person added that white Democrats like Julián and Joaquín Castro, but Gutiérrez has ""more authenticity.""

Tim Ryan, a frequent early-state visitor this year, called Thursday for fellow Democrats Rep. John Conyers and Sen. Al Franken to Nancy) Pelosi. Conyers should resign. And for that matter, Franken should resign too. These are credible allegations, and I believe these women. Congress should set the example for all industries and be a safe place for women to work,"" Ryan tweeted. TIM RYAN WANTS FRANKEN OUT, TOO: Ohio Rep., a frequent early-state visitor this year, called Thursday for fellow Democrats Rep.and Sen.to resign amid recently surfaced allegations of sexual misconduct against both men. ""I agree with (Rep.. Conyers should resign. And for that matter, Franken should resign too. These are credible allegations, and I believe these women. Congress should set the example for all industries and be a safe place for women to work,"" Ryan tweeted.

Why this is notable: Most members of Congress, both Democrats and Republicans, have said the Senate Ethics Committee should investigate Franken. Ryan went a clear step further.

Chuck Schumer told supporters at a breakfast at Manhattan's Harvard Club last week that he'd met with Dallas Mavericks owner Mark Cuban and Starbucks executive chairman Howard Schultz — and, in Schultz's case, talked about 2020, SCHUMER MEETS CUBAN, SCHULTZ: Senate Minority Leadertold supporters at a breakfast at Manhattan's Harvard Club last week that he'd met with Dallas Mavericks ownerand Starbucks executive chairman— and, in Schultz's case, talked about 2020, Page Six reports . Both are the subject of some 2020 buzz — but some Democrats say they think it was more likely just Schumer fund-raising.

LANDRIEU BOOKS A SOUTH CAROLINA TRIP: New Orleans Mayor Mitch Landrieu — who many Democrats believe is seriously weighing a 2020 run — booked a trip to South Carolina, where he'll speak December 9 at the state Democratic Party's Spratt Issues Conference. Also there will be California Rep. Adam Schiff.

Seth Moulton of Massachusetts -- who has vented for months about House Democrats' leadership -- has big ambitions for the military veterans he is backing in the 2018 midterm elections. ""I'm literally recruiting a new generation of leaders for the party,"" MOULTON'S 'NEW GENERATION OF LEADERS': Rep.of Massachusetts -- who has vented for months about House Democrats' leadership -- has big ambitions for the military veterans he is backing in the 2018 midterm elections. ""I'm literally recruiting a new generation of leaders for the party,"" he told me . Moulton, who has criticized House Democratic leadership all year, rolled out his third batch of endorsements of military veterans who are running for House seats — eight this time, bringing his total list of candidates he's backing to 19. Moulton said he is telling veterans who are running for House seats ""to be authentic leaders just like they were in the military. ... We just don't have enough of that right now.""

Why this matters: Moulton, unlike a lot of outside agitators, is also putting in the work. Behind Nancy Pelosi, he's the biggest House Democratic fund-raising draw. Moulton has already visited Iowa and New Hampshire this year and shows up on most lists of vice presidential prospects.

The week ahead:

Kamala Harris Keisha Lance Bottoms ahead of Tuesday's runoff election. — Sunday, December 3: California Sen. campaigns in Atlanta with mayoral candidateahead of Tuesday's runoff election.

Donald Trump holds a campaign-style Roy Moore and Democrat Doug Jones. — Friday, December 8: Presidentholds a campaign-style rally in Pensacola, Florida — just 25 miles from the Alabama border, four days before the special Senate election there between Republicanand Democrat

— Friday, December 8-Saturday, December 9: New Orleans Mayor Mitch Landrieu and California Rep. Adam Schiff appear at the South Carolina Democratic Party's Spratt Issues Conference.

Before you go:",REAL
Dem campaign arm calls on congressman to resign,"Story highlights Rep. Ruben Kihuen was first elected to Congress in 2016

The Nevada Democrat is facing allegation of sexual misconduct in a BuzzFeed report

(CNN) The head of the Democratic Congressional Campaign Committee called on Rep. Ruben Kihuen, a Nevada Democrat, to resign after BuzzFeed News published a report Friday, in which a former staffer says Kiheun sexually harassed and inappropriately touched her during his 2016 congressional campaign.

""Members and candidates must be held to the highest standard. If anyone is guilty of sexual harassment or sexual assault, they should not hold elected office. Congressman Kihuen should resign,"" DCCC Chairman Ben Ray Luján said in a statement provided to CNN.

The woman, who worked as Kihuen's finance director, told BuzzFeed News that Kiuhen made frequent advances and propositioned her despite her repeated rejections. The woman also said that Kiuhen inappropriately touched her thigh on two separate occasions without her consent. CNN has attempted to contact the woman for comment.

The woman said she didn't know how to report her experience at the time, but told BuzzFeed News that she spoke with someone at the DCCC to explain why she was quitting after working for Kihuen for fewer than six months, saying that she felt uncomfortable with the then-candidate. Kihyen's former campaign manager, Dave Chase, was made aware of the woman's complaint. He told BuzzFeed that he confronted Kihuen, who at the time denied any wrongdoing.

In a statement told BuzzFeed and CNN, Kihuen said that the woman was a ""valued member"" of his staff. He did not deny any of the allegations in the story.

Read More",REAL
