"McDonald's manager to get $110,000 for helping catch Tampa suspect","(CNN) A McDonald's manager who gave police a loaded gun that led to the arrest of a suspect in a series of killings in Tampa will receive a $110,000 reward.

Delonda Walker's tip led to Tuesday's arrest of a man who police said killed four seemingly unconnected people in October and November in the city's Seminole Heights neighborhood. The killings terrified residents, and police swarmed the area for weeks amid an intense search for the killer.

Police and victims' families have praised Walker, the manager of a McDonald's in Tampa's Ybor City neighborhood, but there were questions over what the size of her reward would be.

But those questions were put to rest Friday.

Walker has already received about half of the $110,000 reward, according to Christina Barker, an assistant to Tampa Mayor Bob Buckhorn.

Police said Howell Donaldson III, an employee at the same McDonald's, had put a firearm in a food bag and gave it to Walker for safekeeping on Tuesday. At about 2:40 p.m., Walker gave the firearm to a police officer in the fast-food restaurant, who then called for backup and detained Donaldson.

She also told police that Donaldson had expressed his intention to leave the state, according to a criminal affidavit.

That firearm was used in all four of the fatal shootings in Seminole Heights, according to the criminal affidavit. Donaldson admitted that the gun belonged to him, leading to his arrest, the affidavit said.

Donaldson is accused of killing Anthony Naiboa, Monica Hoffa, Benjamin Mitchell and Ronald Felton. He faces four counts of first-degree murder.

Tampa Police Chief Brian Dugan said the gun was a big break in the case that led to the arrest.

""We've had other guns, but we knew this was the one,"" he said Wednesday.

Dugan added that the employee who came forward did the right thing.

""The person who called us -- I cannot thank them enough for standing up and doing the right thing and saying, 'This doesn't seem right, why does this person have a gun in a bag?' ""

""I can't thank the person who called us about the gun in the bag enough for standing up and doing the right thing."" ~Chief Dugan re: #SeminoleHeights murder arrest pic.twitter.com/RSoK4KlPGz — TampaPD (@TampaPD) November 29, 2017

'She's a hero to all of us'

The victims, from left: Anthony Naiboa, Monica Hoffa, Benjamin Mitchell and Ronald Felton.

In a statement to CNN affiliate WFTS , Walker said she was ""overwhelmed and surprised"" by the events leading to Donaldson's arrest.

""At this time, I am speaking exclusively with police and am appreciative that they were nearby and quickly acted upon the information I discovered and shared with the police officer,"" she said. ""I am also appreciative of the outpouring of support from the community. My thoughts are focused on the victims and their families and out of respect for them and the active investigation, please direct inquiries to the Tampa Police Department.""

Monica Hoffa's family told WFTS that Walker was a hero for helping solve the case.

""She took all of that worry that was out there away, and she made us all whole again,"" said Kenny Hoffa, Monica's father.

""She's a hero to all of us and our family. She's part of our family now.""

A number of groups had offered rewards for anyone who provided tips that led to the suspect's arrest.

The $110,000 reward comes from several of these organizations, including $50,000 from the FBI, $20,000 from the Bureau of Alcohol, Tobacco, Firearms and Explosives and $10,000 from the Florida Department of Law Enforcement.

Crime Stoppers of Tampa Bay initially said Walker was not eligible to receive its $5,000 reward money because she did not actually call the tip line, although the group later put out a statement saying the money would be paid out, according to WFTS.

However, local businessman Richard Gonzmart personally delivered a $9,000 check to her Thursday, making good on his promise to contribute to the reward.",REAL
Delaware earthquake registers at 4.1,"(CNN) A magnitude 4.1 earthquake struck Thursday afternoon near Dover, Delaware, and was felt from New York to Baltimore.

The rare mid-Atlantic earthquake was about 6 miles east-northeast of Dover and was registered at a depth of 5 miles, the US Geological Survey reported.

It was the strongest recorded earthquake in the state's history, Jaime Tomlinson, a geologist with the Delaware Geological Survey, said. An earthquake in 1871 predated seismograph recording but was estimated at 4.1.

""We definitely felt it here,"" said Master Cpl. Gary Fournier of Delaware State Police. ""We have not received any reports of damage at this time. (My) house shook and you could hear thing rattle. It sounded like a train and lasted about a second.""

Roland Balik, a spokesman for the 436th Airlift Wing at Dover Air Force Base, said he did not feel it but said people on base were talking about it.

Read More",REAL
Tax reform is why Republicans haven't turned on Trump,"(CNN) Washington Republicans have spent long stretches of the past 10 months -- their first with unified control of the federal government in a decade -- alternately contending with and rationalizing President Donald Trump's erratic behavior.

That those competing impulses should clash so dramatically, with a former top administration official standing in court on the same day long-desired tax cuts near passage, is a coincidence befitting the opportunity and peril Trump represents for his party.

Some Republicans have groused about him in private, others scolded or lamented him in public remarks; most dodged or demurred when confronted with the controversy du jour. When compelled, a few might issue censorious statements or tweet their concerns. But Trump has carried on, spitting Twitter venom at political foes (and allies he felt slighted by), seemingly oblivious to -- or actively spiteful of -- the sensitive mechanisms and relationships that typically drive policy-making on Capitol Hill.

Republicans in the Senate, and a handful in the House, have been subject to routine humiliations and insults from their President, even as his own team, including campaign officials and his former national security adviser, came under increasing scrutiny for their alleged ties to Russia.

After Obamacare repeal failed and his agenda looked to be falling apart, Trump pressed on, personally demeaning GOP officials who crossed him. Senate Majority Leader Mitch McConnell, Sen. John McCain, Sen. Jeff Flake, Sen. Bob Corker -- the list goes on -- have all come under attack. The latter pair will retire rather than seek re-election in 2018.

Read More",REAL
Bob Corker's $1 trillion tax reform problem,"Story highlights Tax plan is slated to add $1 trillion to the deficit, even with economic growth

Corker engaged in negotiations on the Senate floor late Thursday

Washington (CNN) It's (officially) official: The GOP tax plan would add more than $1 trillion to the federal budget deficit over the next decade — even when factoring in economic growth.

And this could put some Republicans — like Sen. Bob Corker — between a rock and a hard place.

The Tennessee lawmaker has previously pledged that he won't vote for a plan that adds a single penny to the federal debt.

For some time, Republicans made a plausible argument: Government estimates, which projected a cumulative $1.4 trillion added to the debt, didn't take into account a boom of economic growth that the tax package would prompt.

But now, the nonpartisan Joint Committee on Taxation says economic growth will make up for only $408 billion of that, leaving a gaping $1 trillion hole to fill.

Read More",REAL
Trump denies that Tillerson is on his way out,"Story highlights Tillerson isn't leaving, Trump claims on Twitter

Tensions have between Trump and Tillerson have been high for months

Washington (CNN) President Donald Trump on Friday repudiated reports that Secretary of State Rex Tillerson's days in Foggy Bottom are numbered after days of speculation.

""The media has been speculating that I fired Rex Tillerson or that he would be leaving soon - FAKE NEWS! He's not leaving and while we disagree on certain subjects, (I call the final shots) we work well together and America is highly respected again!"" Trump tweeted, alongside a photo from Tillerson's swearing-in.

The media has been speculating that I fired Rex Tillerson or that he would be leaving soon - FAKE NEWS! He's not leaving and while we disagree on certain subjects, (I call the final shots) we work well together and America is highly respected again!https://t.co/FrqiPLFJ1E — Donald J. Trump (@realDonaldTrump) December 1, 2017

Tensions have been high between Trump and Tillerson for months now, and they were exacerbated after it was reported that Tillerson privately referred to the President as a moron over the summer.

The relationship between White House chief of staff John Kelly and Tillerson soured in recent months following the incident becoming public, leaving the former Exxon CEO without a single top ally in the West Wing as talk has ramped up of him being replaced at the State Department.

Kelly, once Tillerson's fiercest defender in the West Wing, has stopped defending him privately, leaving him more isolated from the West Wing than ever before, according to a top White House official.

Read More",REAL
Trump to hold rally near Alabama,"(CNN) President Donald Trump will hold a campaign-style rally in Pensacola, Florida, next Friday -- just 25 miles from the Alabama border and days before the Alabama special election for US Senate.

The move comes amid controversy surrounding the Republican candidate, Roy Moore, who has been accused by several women of pursuing inappropriate sexual relationships with them when they were between 14 and 19 and he was in his early 30s.

Trump has not publicly condemned Moore, as many of his Republican colleagues in Washington have, but instead has kept criticizing Democratic Alabama Senate candidate Doug Jones.

When asked about the race last week, Trump continued to point out that Moore had denied the allegations.

""He denies it. Look, he denies it,"" Trump said last week. ""If you look at all the things that have happened over the last 48 hours. He totally denies it. He says it didn't happen. And you know, you have to listen to him also.""

Read More",REAL
Senate passes sweeping GOP tax plan in early hours of Saturday morning,"(CNN) The Senate passed its tax reform bill in the early hour of Saturday morning, following a day full of Republican leaders making changes to bring enough members on board and a long night full of heated rhetoric on both sides of the aisle.

The vote was 51-49, mostly along party lines. Sen. Bob Corker of Tennessee was the only Republican to vote against the bill, citing concerns about growing the deficit.

Congressional negotiators continued to make changes to the bill -- including handwriting alterations on to the document -- up until just hours before the final vote, with Democrats sharply criticizing Republicans for not giving members enough time to read the sweeping legislation that would overhaul the US tax system.

The House of Representatives approved its own tax reform plan last month, and the two chambers are expected to go to conference to reconcile the two bills, but passing the legislation Saturday was a huge victory for Senate Republicans and President Donald Trump, both looking for significant legislative achievements.

Arizona Sen. Jeff Flake, a key holdout, announced just after noon that he would back the plan. Republicans could pass the legislation with 50 members and a tie-breaking vote from Vice President Mike Pence, but after Sen. Susan Collins of Maine announced her support Friday afternoon, Pence's would-be vote was unnecessary, as Collins' vote brought the tally to 51. Sen. Bob Corker of Tennessee is the only expected Republican to vote no.

""We have the votes,"" Senate Majority Leader Mitch McConnell said walking to the Senate floor following a conference meeting Friday.

Following the vote in the chamber -- which happened just before 2 a.m. ET -- Republicans bestowed a hefty number of backslaps and handshakes with lawmakers who have been integral in the process including Sen. Pat Toomey of Pennsylvania and Rob Portman of Ohio. While Senate Whip John Cornyn of Texas stood over the vote tallying sheet watching it closely, McConnell stood to the side. At one point the Majority Leader looked up at Pence, who was presiding, pointed at the VP, winked, and gave him a thumbs up.

In a public statement announcing his support, Flake said he was given promises from Senate GOP leadership and the Trump administration for a ""growth-oriented legislative solution"" to protect recipients of the Deferred Action for Childhood Arrivals program.

Republican leaders were racing Thursday night and Friday morning to find support for the bill, hoping to avoid a repeat of the health care bill debacle this summer that left them empty handed. Tensions were running high in the Senate, where Republican tax writers were reworking the tax bill, trying to find a way to satisfy competing interests and shore up votes.

The bill received a major boost Friday morning when Daines announced he would back the bill, after he was assured of ""significant tax relief for Main Street businesses."" Johnson later Friday morning issued a statement supporting the bill.

Senate Republicans met earlier in the Strom Thurmond Room of the Capitol to continue the bill's negotiation Friday morning. Collins, a key undecided vote, said GOP leaders are still ""working through a few more of my issues"" but as she was walking toward the conference meeting, she said, ""We're making great progress.""

But behind the scenes, Republican members and aides were fuming at Corker, who was demanding last-minute offsets for the GOP tax bill out of fear that it would raise the deficit. Corker's demands weren't entirely new , but were crystallized further Thursday afternoon when the Joint Committee on Taxation, the independent tax scorekeeper, announced that even with projected economic growth, the Republican tax bill still would add more than $1 trillion to the deficit over 10 years . Then, Corker learned that a trigger he demanded in the tax bill that would automatically increase taxes if the tax legislation didn't generate the growth that Republicans anticipated, wouldn't pass Senate rules and couldn't be included.

The news led to Corker holding court on the Senate floor on and off for nearly an hour as an amendment vote was held open and dozens of reporters filled the Senate chamber to watch the drama unfold from above.

As CNN reported earlier Thursday , a throng of Republicans encircled Corker and Flake as Sen. Pat Toomey, a member on the Senate Finance Committee who has cut deals with Corker on the tax bill already, stood next to Corker, explaining something at length.

At one point, the Senate's Parliamentarian came over and Corker used his hands to try to convey a point to her for several minutes.

Corker walked across the chamber to speak with Sen. Angus King, an independent from Maine. The two men looked over some papers, then walked back over the Republican huddle. Corker asked more questions. At one point Toomey grew audibly frustrated, this time standing face-to-face with the Tennessee Republican.

""Furious,"" one aide responded when asked how GOP senators were responding behind closed doors to what Corker did on the floor. ""Didn't need to be done publicly. Didn't need to cause a scene. We know it's a problem. Fix it behind closed doors.""

Right now, according to aides, staff and senators are working through several different proposals to try to address Corker's issues -- issues that grew more problematic with the JCT report.

Corker, according to aides, wants even more revenue than the trigger would've snapped into effect.

""When the trigger doesn't work, you have to come up with, I think, $350 billion,"" said Sen. Lindsey Graham, a Republican from South Carolina. ""That makes everything different. So, we'll get there, because failure's not an option.""

There were a few options for getting back the revenue, but none of them would satisfy the entire conference. One option, Texas Sen. John Cornyn floated, would be to gradually raise the corporate tax rate, which Republicans had planned to lower to 20% . That would surely upset House Republicans and Trump who had lobbied aggressively to drop the corporate tax rate to 15%. The other option was to not completely repeal the alternative minimum tax , a levy that is used to ensure wealthy individuals cannot just use tax loopholes to avoid paying taxes all together.

But Republicans were still working on how to put the pieces together.

McConnell can afford to lose two Republican senators, but with so many competing concerns, leadership will have to make tough decisions about who to appease based on the math. Flake joins Corker in sharing concerns about the deficit and GOP aides say leaders now view Corker and Flake as a package deal, meaning they either assuage their concerns, or figure out a way not to lose any other senators if they want to pass the bill at all.

Johnson had tried to lobby leadership to give so-called pass-throughs -- businesses that pass profits to owners who pay taxes on the individual side -- additional tax breaks. Collins, who was a key ""no"" vote on health care also must be won over. Collins has asked leadership and the Trump administration to promise her that they will support a package that she says would help stabilize the Obamacare marketplace after Republicans repeal the individual mandate in their tax bill. She has also asked leadership to include a provision that would allow individuals to deduct state and local property taxes up to $10,000.

The predicament leadership faces now isn't all that unlike the one they found themselves in on health care. If McConnell appeases Johnson and boosts the tax break for pass-throughs (which costs money), he could alienate Corker and Flake who have lobbied to make the tax bill less expensive. If he appeases Collins, he could face problems with the Senate bill when it goes to conference with the House.

Collins acknowledged the struggle ahead.

""I'm going to have more discussions with the House,"" Collins told reporters on Thursday evening.

This story has been updated and will continue to update with additional reporting.",REAL
Voyager 1 spacecraft's thrusters fired up for first time since 1980,"Story highlights Voyager 1 is in interstellar space and is NASA's farthest spacecraft

Scientists were looking for a new way to reorient Voyager 1

(CNN) It's a good idea to have a backup plan, especially in interstellar space.

NASA scientists needed to reorient the 40-year-old Voyager 1 -- the space agency's farthest spacecraft -- so its antenna would point toward Earth, 13 billion miles away. But the ""attitude control thrusters,"" the first option to make the spacecraft turn in space, have been wearing out.

So NASA searched for a Plan B, eventually deciding to try using four ""trajectory correction maneuver"" (TCM) thrusters, located on the back side of Voyager 1. But those thrusters had not been used in 37 years. NASA wasn't sure they'd work.

Tuesday, engineers fired up the thrusters and waited eagerly to find out whether the plan was successful. They got their answer 19 hours and 35 minutes later, the time it took for the results to reach Earth: The set of four thrusters worked perfectly. The spacecraft turned and the mood at NASA shifted to jubilation.

""The Voyager team got more excited each time with each milestone in the thruster test. The mood was one of relief, joy and incredulity after witnessing these well-rested thrusters pick up the baton as if no time had passed at all,"" said Todd Barber, a propulsion engineer at NASA's Jet Propulsion Laboratory in Pasadena, California

Read More",REAL
Russia investigation 'wearing' on White House,"Washington (CNN) President Donald Trump , who was already incensed by the idea that his accomplishments weren't getting the credit they deserve, grew more worried on Friday after news broke that Michael Flynn , his former national security adviser and longtime campaign aide, pleaded guilty for lying to the FBI.

""I think that Russia investigation is wearing on all of us, the President most of all,"" said a source close to Trump. ""But I think he is more concerned about the state of his accomplishments and this presidency.""

Flynn's plea is the closest that Special Counsel Robert Mueller's probe into the Trump campaign's possible connection to Russian meddling in the 2016 election has come to the Oval Office. It was a dramatic step for an investigation that has infuriated Trump since its creation. Flynn spent countless hours briefing the businessman-turned-politician during the 2016 campaign and was Trump's top national security aide.

How it unfolded

Trump was briefed on Flynn's plea deal on Friday morning, a senior White House official told CNN. The president, the source said, had anticipated Flynn would get swept up into Mueller's investigation for weeks.

Externally, Trump's top aides and surrogates were trying to spin the news as a positive step for Trump that signals Mueller's investigation could soon be wrapping up. A senior White House official said Friday that the president is feeling ""no anxiety"" about the situation.

Another source close to the White House described the President and his team as in denial on the Russia investigation. They are ""totally in a bubble.""

This source said the White House should be taking the Flynn news much more seriously. ""This is like a red alert,"" the source said.

But the source said White House officials said the President expects to be cleared by Mueller's team before much longer.

""They think he's going to be exonerated very soon,"" the source added.

In more reflective moments, though, Trump confidants acknowledge that the President is bothered by the Flynn news, particularly because he is worried that another deluge of stories about Russia could overshadow his achievements.

""Every single one of us has come to expect this, including the President,"" a source close to Trump said of the Flynn news. ""The worry is this could cool down what is otherwise a pretty strong march towards the economic growth we need.""

The source acknowledged that Flynn's plea -- along with indictments of former Trump campaign aides Paul Manafort and Rick Gates and another plea by former Trump campaign foreign policy adviser George Papadopoulos in October -- ""damage Trump's ability to get things done.""

A manifestation of this frustration: As Trump's White House aides devised a communication strategy for Flynn's plea, Republicans in the Senate said they had the votes to pass the Trump-backed tax plan, an achievement the Trump White House has longed for.

Even as aides swore all was well within the White House, Trump was noticeably kept at arms-length for much of the day. When Prime Minister Fayez al-Sarraj of Libya stepped out of his car, the at-times loquacious Trump ignored shouted questions. And a previously planned photo-op with Trump and al-Sarraj was abruptly canceled as reporters waited outside the Oval Office.

Clearest sign yet

Mueller's court filings are the clearest sign yet of potential coordination between Flynn and a top Trump advisers regarding contact with Russian officials. CNN reported on Friday that Jared Kushner -- Trump' son-in-law and top adviser -- was the ""very senior member of the Presidential Transition Team"" who directed Flynn to contact the Russian ambassador and other countries on an upcoming UN Security Council vote on Israeli settlements.

The probe is now zeroing in on Trump's inner circle , making it harder for the Trump administration to distance itself from the action. When Manafort and Gates were indicted, multiple Trump sources told CNN the indictments had nothing to do with the White House because the duo never worked for Trump as president.

That isn't the case for Flynn, who was Trump's top national security aide for less than a month before he was fired for lying to the Vice President Mike Pence.

Trump, according to multiple sources, considered Flynn a friend, enjoyed his company on the campaign trail and in the White House and believed that the retired United States Army Lieutenant General was an honorable person.

JUST WATCHED Trump's praise of Michael Flynn over the years Replay More Videos ... MUST WATCH Trump's praise of Michael Flynn over the years 01:08

That means even though he canned his longtime aide under pressure in February, Friday's news was likely still difficult to take. Trump said earlier this year that Flynn was a ""wonderful man"" who has been ""treated unfairly.""

The President ""feels sorry for Flynn,"" a senior White House official said, because he ""likes"" the former national security adviser. The official add that Trump is ""thinking about Flynn and his family"" during this time.

One source close to the Trump added that the White House was balancing the fact that ""the President was close to Flynn and spent a great deal of time with him"" and ""the truisms that General Flynn created his own problems here.""

As for a presidential pardon for Flynn, the senior White House official said that was ""absolutely not under consideration.""

While Trump was bothered by Flynn's guilty plea, aides close to Pence feel vindicated because the former national security adviser was fired for lying to Pence in the first place.

What Flynn admitted Friday is ""what we have known all along,"" a source told CNN. Flynn, the source said, lied to the vice president and he lied on the same matter to federal authorities.",REAL
